{
  "$schema": "https://json-schema.org/draft/2020-12/schema",
  "$id": "rag-ime.contract.agent-message.v1",
  "type": "object",
  "required": ["schemaVersion", "id", "sessionId", "turnId", "role", "status", "blocks", "attachments", "citations", "createdAtMs"],
  "properties": {
    "schemaVersion": {"type": "string", "const": "rag-ime.agent-message.v1"},
    "id": {"type": "string", "minLength": 1},
    "sessionId": {"type": "string", "minLength": 1},
    "turnId": {"type": "string"},
    "role": {"type": "string", "enum": ["user", "assistant", "tool", "system"]},
    "status": {"type": "string", "enum": ["queued", "streaming", "completed", "failed", "aborted"]},
    "blocks": {"type": "array", "items": {"$ref": "#/$defs/block"}},
    "attachments": {"type": "array", "items": {"type": "string"}},
    "citations": {"type": "array", "items": {"type": "string"}},
    "createdAtMs": {"type": "integer", "minimum": 0},
    "completedAtMs": {"type": ["integer", "null"]},
    "provider": {"type": "string"},
    "model": {"type": "string"},
    "usage": {"$ref": "#/$defs/usage"}
  },
  "$defs": {
    "usage": {
      "type": "object",
      "required": ["input", "output", "cacheRead", "cacheWrite", "totalTokens"],
      "properties": {
        "input": {"type": "integer", "minimum": 0},
        "output": {"type": "integer", "minimum": 0},
        "cacheRead": {"type": "integer", "minimum": 0},
        "cacheWrite": {"type": "integer", "minimum": 0},
        "totalTokens": {"type": "integer", "minimum": 0}
      },
      "additionalProperties": false
    },
    "block": {
      "type": "object",
      "required": ["id", "type", "status", "presentationKind", "data"],
      "properties": {
        "id": {"type": "string", "minLength": 1},
        "schemaVersion": {"type": "string", "const": "rag-ime.agent-block.v1"},
        "type": {"type": "string", "enum": ["text", "code", "reasoning_summary", "progress", "tool_call", "tool_result", "citation", "image", "audio", "file", "sticker", "task_plan", "diff", "approval", "error", "card", "checklist", "table", "artifact", "reference", "status", "unknown"]},
        "status": {"type": "string", "enum": ["queued", "running", "completed", "failed", "aborted"]},
        "presentationKind": {"type": "string", "minLength": 1},
        "data": {"type": "object"},
        "summary": {"type": "string", "maxLength": 240},
        "source": {
          "type": "object",
          "required": ["kind", "ref"],
          "properties": {
            "kind": {"type": "string", "maxLength": 80},
            "ref": {"type": "string", "maxLength": 240}
          },
          "additionalProperties": false
        },
        "visibility": {"type": "string", "enum": ["private_session", "room_post", "root_post"]},
        "digest": {"type": "string", "pattern": "^[0-9a-f]{64}$"},
        "ref": {"type": "string", "maxLength": 240},
        "generation": {"type": "integer", "minimum": 0}
      }
    }
  }
}
